{
  "schema": "free-graph.packet/v0",
  "purpose": "Public pressure specimen showing how a private lyric-corpus observation can preserve provenance without exporting the excerpt or widening the global relation grammar.",
  "modes": ["seed"],
  "scope": {"task": "Preserve one Bandcamp archaeology pressure case as a public-safe graph packet.", "worlds": ["Autodiscography lyric corpus", "Free Graph substrate"], "as_of": "2026-08-23", "resolution": "digest-only private source plus normalized portable relation"},
  "task_world_cut": {"status": "sufficient", "selected_ids": ["fgs:sha256:9f2787de00f6fcf5f429a4bca5328d6438ce1b82f00f1fead8bd8bd4fcb21e15", "fgn:sha256:ff66105e816773070f2ab3a5638442d798430c080dc55a8e1c6abae3335227cb", "fgn:sha256:8cbcfab1514f23470b6578c0f0103eed3dc36e33634baabc4db66a319e6a8f55", "fgl:sha256:b71084ce69be29ac2a8ced5cf289b7119bcbc7e110db0f84450ab86a5e64c39d"], "owner_head_source_ids": [], "omitted": [{"door": "Full Bandcamp archaeology packet", "reason": "Not required to prove the contract seam and contains private pointer-only source material."}], "rationale": "One redacted source, one artifact, one interpretive claim, and one traversal edge are sufficient to pressure the public contract."},
  "sources": [{"id": "fgs:sha256:9f2787de00f6fcf5f429a4bca5328d6438ce1b82f00f1fead8bd8bd4fcb21e15", "source_class": "direct-observation", "locator": {"system": "ChatGPT conversation upload", "container": "BandCamp(1).txt", "coordinate": "bounded lyric archaeology source", "revision": "file-sha256:8ee9001e694f3a2ecdc96d01370294e51d78cd1efe841b83f83766fb772d7bca", "resolution": "exact source coordinate retained privately"}, "observed_at": "2026-08-23", "acquisition": "conversation-upload", "digest": "sha256:3f0d302f769500170871cc85122b0527acdfed992b07dc293cd4fb2fc11af3c6", "redaction": "private lyric excerpt intentionally omitted from this public repository", "access": "private", "export": "pointer-only", "authority": "source-local", "extensions": {"source_role": "lyric-corpus-primary", "label": "The Porch Is Already Bigger — living map/seed bridge"}}],
  "nodes": [{"id": "fgn:sha256:ff66105e816773070f2ab3a5638442d798430c080dc55a8e1c6abae3335227cb", "kind": "artifact", "label": "The Porch Is Already Bigger", "aliases": ["fg://artifact/porch"], "status": "observed", "source_ids": ["fgs:sha256:9f2787de00f6fcf5f429a4bca5328d6438ce1b82f00f1fead8bd8bd4fcb21e15"]}, {"id": "fgn:sha256:8cbcfab1514f23470b6578c0f0103eed3dc36e33634baabc4db66a319e6a8f55", "kind": "claim", "label": "Living-map / mutate-the-seed language may resonate with later Free Graph seed-scatter practice", "aliases": ["fg://claim/living-map-resonance"], "status": "proposed", "source_ids": ["fgs:sha256:9f2787de00f6fcf5f429a4bca5328d6438ce1b82f00f1fead8bd8bd4fcb21e15"], "claim_class": "inferential", "witness_requirement": "owner-defined", "extensions": {"claim_role": "interpretive", "witness_note": "chronology/provenance check"}}],
  "links": [{"id": "fgl:sha256:b71084ce69be29ac2a8ced5cf289b7119bcbc7e110db0f84450ab86a5e64c39d", "from": "fgn:sha256:ff66105e816773070f2ab3a5638442d798430c080dc55a8e1c6abae3335227cb", "verb": "connects", "to": "fgn:sha256:8cbcfab1514f23470b6578c0f0103eed3dc36e33634baabc4db66a319e6a8f55", "qualifier": "opens-question: resemblance is preserved without claiming ancestry", "status": "proposed", "source_ids": ["fgs:sha256:9f2787de00f6fcf5f429a4bca5328d6438ce1b82f00f1fead8bd8bd4fcb21e15"], "authority": "none", "extensions": {"source_verb": "bears-on", "normalization": "non-test use mapped to connects"}}],
  "residual_fog": ["The chronology between lyric language and later eCODE/Free Graph vocabulary is not established here."],
  "non_imports": ["Lyric resemblance does not establish technical ancestry, authorial intent, or project authority.", "The private source excerpt is not exported into this public repository."],
  "packet_id": "fgp:sha256:f898d8561fdef667dbce03bb0e46f2328fcd7131eecb1257da5cc3f8cb65af44"
}
