{
  "extensions": {"expected_terminal_state": "unresolved", "specimen": "free-graph-substrate-v0"},
  "links": [
    {"authority": "none", "from": "fgn:sha256:dbfc86df81977dbea31a8c36f10afb37b8fb52da6b0a34fc8dda362a582d673b", "id": "fgl:sha256:d5059e3fa9e2806e16d0b04c37cdac9495f80f2f6a289291be03ea834d55958f", "qualifier": "mentions", "source_ids": ["fgs:sha256:113914a88e9b500e137c036fa358c47a2b41826bcc45d8d0648e5d5d07e763fa"], "status": "observed", "to": "fgn:sha256:5d9c3718da5881d8636b081f375f44f7aa4f133359ac4dfef137ba254002926b", "verb": "connects"},
    {"authority": "none", "from": "fgn:sha256:5d9c3718da5881d8636b081f375f44f7aa4f133359ac4dfef137ba254002926b", "id": "fgl:sha256:9e95ad75a1d8345290ff8b68c3ca42d31c9d98c394cfef61e7748feddcb57caf", "qualifier": "conversation-suggests", "source_ids": ["fgs:sha256:113914a88e9b500e137c036fa358c47a2b41826bcc45d8d0648e5d5d07e763fa"], "status": "proposed", "to": "fgn:sha256:187d6b00352c27c824df97d37bbaedc4dd228d7e78cf1e2651deace6e5589cc7", "verb": "connects"},
    {"authority": "none", "from": "fgn:sha256:187d6b00352c27c824df97d37bbaedc4dd228d7e78cf1e2651deace6e5589cc7", "id": "fgl:sha256:17aa343257872e95be7286bce251da3607ffac6a8325e22262b708c16fde10be", "qualifier": "possibly-connects-to", "source_ids": ["fgs:sha256:113914a88e9b500e137c036fa358c47a2b41826bcc45d8d0648e5d5d07e763fa", "fgs:sha256:90916e162db9a77548d886c1efbbd2d148e8fb9bb2ca69d58bc97bd09b6c9bd0"], "status": "unresolved", "to": "fgn:sha256:13dfd387dc02d1d0374ba2f8e23d24d4b56dc33afee3e5692f690cc8dc9e91b2", "verb": "connects"},
    {"authority": "none", "from": "fgn:sha256:187d6b00352c27c824df97d37bbaedc4dd228d7e78cf1e2651deace6e5589cc7", "id": "fgl:sha256:9de7c9c3388b2cf8c2f835b88f1410c7b255c250c7c86ab1b02b860d698d1dad", "qualifier": "opens-question", "source_ids": ["fgs:sha256:113914a88e9b500e137c036fa358c47a2b41826bcc45d8d0648e5d5d07e763fa", "fgs:sha256:0dae5319c04c19cbf6682fa9c4b62fcbecec4ba0f8a36d2447298cbbbb63050e", "fgs:sha256:90916e162db9a77548d886c1efbbd2d148e8fb9bb2ca69d58bc97bd09b6c9bd0"], "status": "unresolved", "to": "fgn:sha256:4cecf72b96992f74020687892ee13de6f602991fcc8dba6ff859b9f63471ab74", "verb": "connects"}
  ],
  "modes": ["re-enter", "seed"],
  "nodes": [
    {"aliases": ["fg://encounter/wav-bank-as-space"], "id": "fgn:sha256:dbfc86df81977dbea31a8c36f10afb37b8fb52da6b0a34fc8dda362a582d673b", "kind": "encounter", "label": "WAV-bank-as-space conversation encounter", "source_ids": ["fgs:sha256:113914a88e9b500e137c036fa358c47a2b41826bcc45d8d0648e5d5d07e763fa"], "status": "observed"},
    {"aliases": ["fg://artifact/autodiscography-wav-bank"], "id": "fgn:sha256:5d9c3718da5881d8636b081f375f44f7aa4f133359ac4dfef137ba254002926b", "kind": "artifact", "label": "Autodiscography WAV Bank", "source_ids": ["fgs:sha256:113914a88e9b500e137c036fa358c47a2b41826bcc45d8d0648e5d5d07e763fa"], "status": "observed"},
    {"aliases": ["fg://claim/wav-bank-as-spatial-substrate"], "claim_class": "design", "id": "fgn:sha256:187d6b00352c27c824df97d37bbaedc4dd228d7e78cf1e2651deace6e5589cc7", "kind": "claim", "label": "A WAV bank may function as a spatial substrate", "source_ids": ["fgs:sha256:113914a88e9b500e137c036fa358c47a2b41826bcc45d8d0648e5d5d07e763fa"], "status": "proposed", "witness_requirement": "owner-defined"},
    {"aliases": ["fg://artifact/haunted-toaster-embryo"], "id": "fgn:sha256:13dfd387dc02d1d0374ba2f8e23d24d4b56dc33afee3e5692f690cc8dc9e91b2", "kind": "artifact", "label": "Haunted Toaster embryo", "source_ids": ["fgs:sha256:113914a88e9b500e137c036fa358c47a2b41826bcc45d8d0648e5d5d07e763fa", "fgs:sha256:90916e162db9a77548d886c1efbbd2d148e8fb9bb2ca69d58bc97bd09b6c9bd0"], "status": "proposed"},
    {"aliases": ["fg://question/wav-space-toaster-witness"], "id": "fgn:sha256:4cecf72b96992f74020687892ee13de6f602991fcc8dba6ff859b9f63471ab74", "kind": "question", "label": "Can a pinned WAV bank produce a discriminable spatial witness in one pinned Toaster build?", "source_ids": ["fgs:sha256:113914a88e9b500e137c036fa358c47a2b41826bcc45d8d0648e5d5d07e763fa", "fgs:sha256:90916e162db9a77548d886c1efbbd2d148e8fb9bb2ca69d58bc97bd09b6c9bd0"], "status": "unresolved"}
  ],
  "non_imports": ["The conversation does not establish that the WAV bank is Toaster architecture.", "Front Room orientation does not grant Haunted Toaster authority.", "Recurrence of the idea would not upgrade it to supported or locally adopted."],
  "purpose": "Prove that a conversation can seed a rediscoverable WAV-bank-as-space path while missing owner-current evidence stops promotion.",
  "residual_fog": ["No current Haunted Toaster owner head or gate manifest was inspected.", "No exact hypermathal mapping, Hero Spiral implementation, or Haunted Phonography source anchor is present in this specimen.", "No machine or human witness has tested the design claim."],
  "schema": "free-graph.packet/v0",
  "scope": {"as_of": "2026-08-23", "resolution": "conversation excerpt plus Front Room orientation", "task": "Seed one bounded crossing and preserve the unresolved owner door.", "worlds": ["Free Graph substrate", "Haunted Toaster (owner state not entered)"]},
  "sources": [
    {"access": "private", "acquisition": "user-supplied paste", "authority": "none", "digest": "sha256:008c00aa48277daa34cf630ffe9bfd16040a753085414cbc6f6ec8ef24a2e41a", "export": "pointer-only", "id": "fgs:sha256:113914a88e9b500e137c036fa358c47a2b41826bcc45d8d0648e5d5d07e763fa", "locator": {"container": "Free Graph skill-creation request", "coordinate": "user-supplied raw source reply B / crucial distinction", "resolution": "exact bounded excerpt", "revision": "message body supplied 2026-08-23", "system": "ChatGPT conversation"}, "observed_at": "2026-08-23", "source_class": "conversation-witness", "speaker": "assistant reply preserved by user", "extensions": {}, "redaction": "private source content omitted from public repository; digest and source coordinate retained"},
    {"access": "public", "acquisition": "connected GitBook page read", "authority": "source-local", "digest": "sha256:83034f035272701f0280dcaad7c7702914e6f08b5c7f61bada6496a3a0e2ce76", "excerpt": "Orientation is not retrieval.", "export": "portable", "id": "fgs:sha256:0dae5319c04c19cbf6682fa9c4b62fcbecec4ba0f8a36d2447298cbbbb63050e", "locator": {"container": "the static collective / HILTtUulCBDqDzXXk6RQ", "coordinate": "page ZNnvl6rFZP6SiAKvoiTW / The Front Room", "resolution": "exact bounded excerpt", "revision": "page id observed 2026-08-23; revision not exposed", "system": "GitBook", "uri": "https://app.gitbook.com/o/ddlx1UAH93SFyQsNFNa4/s/HILTtUulCBDqDzXXk6RQ/"}, "observed_at": "2026-08-23", "source_class": "project-source", "extensions": {}},
    {"access": "public", "acquisition": "current-run boundary decision", "authority": "none", "digest": "sha256:c548f6b79e16be196ca3a1fcbd98eae4f54132d98d4c6565d2ab70ffdbbf7672", "excerpt": "The current owning Haunted Toaster source was not entered during this substrate-only specimen.", "export": "portable", "id": "fgs:sha256:90916e162db9a77548d886c1efbbd2d148e8fb9bb2ca69d58bc97bd09b6c9bd0", "locator": {"coordinate": "Task World Cut / omitted owner door", "resolution": "run receipt", "revision": "run dated 2026-08-23", "system": "current skill-creation run"}, "observed_at": "2026-08-23", "source_class": "unresolved-receipt", "extensions": {}}
  ],
  "task_world_cut": {"omitted": [{"door": "Current Haunted Toaster owner head and gate manifest", "reason": "This is a substrate validator specimen, not a Toaster project re-entry."}], "owner_head_source_ids": [], "rationale": "Conversation testimony and current Front Room law are sufficient to seed the path, but not to test or constitute anything in Haunted Toaster.", "selected_ids": ["fgs:sha256:113914a88e9b500e137c036fa358c47a2b41826bcc45d8d0648e5d5d07e763fa", "fgs:sha256:0dae5319c04c19cbf6682fa9c4b62fcbecec4ba0f8a36d2447298cbbbb63050e", "fgs:sha256:90916e162db9a77548d886c1efbbd2d148e8fb9bb2ca69d58bc97bd09b6c9bd0", "fgn:sha256:dbfc86df81977dbea31a8c36f10afb37b8fb52da6b0a34fc8dda362a582d673b", "fgn:sha256:5d9c3718da5881d8636b081f375f44f7aa4f133359ac4dfef137ba254002926b", "fgn:sha256:187d6b00352c27c824df97d37bbaedc4dd228d7e78cf1e2651deace6e5589cc7", "fgn:sha256:13dfd387dc02d1d0374ba2f8e23d24d4b56dc33afee3e5692f690cc8dc9e91b2", "fgn:sha256:4cecf72b96992f74020687892ee13de6f602991fcc8dba6ff859b9f63471ab74", "fgl:sha256:d5059e3fa9e2806e16d0b04c37cdac9495f80f2f6a289291be03ea834d55958f", "fgl:sha256:9e95ad75a1d8345290ff8b68c3ca42d31c9d98c394cfef61e7748feddcb57caf", "fgl:sha256:17aa343257872e95be7286bce251da3607ffac6a8325e22262b708c16fde10be", "fgl:sha256:9de7c9c3388b2cf8c2f835b88f1410c7b255c250c7c86ab1b02b860d698d1dad"], "status": "unresolved"},
  "packet_id": "fgp:sha256:4847bd5f947490a9fcd9f660544144b341b2b87019e429438580f08d174a655c"
}
